{
  "request_id": "REQ-review-propagation",
  "plan_id": "PLAN-review-propagation",
  "source": {
    "workflow": "WF-02",
    "request_id": "REQ-review-propagation",
    "planning_state": "PLANNED"
  },
  "review_signal": {
    "human_review_required": true,
    "approval_status": "pending_human_review",
    "reason_codes": [
      "HIGH_IMPACT_REVIEW_REQUIRED"
    ],
    "review_requirement_ids": [
      "R-RISK"
    ]
  },
  "tasks": [
    {
      "task_id": "T-001",
      "title": "Prepare high-impact change",
      "requirement_ids": [
        "R-RISK"
      ]
    },
    {
      "task_id": "T-002",
      "title": "Verify change",
      "requirement_ids": [
        "R-OTHER"
      ],
      "depends_on": [
        "T-001"
      ]
    },
    {
      "task_id": "T-003",
      "title": "Update unrelated documentation",
      "requirement_ids": [
        "R-UNRELATED"
      ]
    }
  ]
}
